{
 "exercises": [
  {
   "Title": "CURTSY LUNGE",
   "Desc": "The curtsy lunge is a variation of the traditional lunge exercise that targets the muscles of the lower body, particularly the quadriceps, glutes, and adductors, while also engaging the core for stability. It involves stepping one leg behind the body at an angle, similar to performing a curtsy, hence the name. The curtsy lunge is an effective exercise for targeting multiple muscles in the lower body and can help improve strength, stability, and mobility. It’s commonly incorporated into lower body workouts or as part of a dynamic warm-up routine. Here’s how to perform a curtsy lunge:  Mastering the curtsy lunge involves paying attention to your form and gradually increasing the challenge as you become more proficient. As you lower your body, focus on pressing through the heel of your front foot to engage the muscles in your quads and glutes. Like any exercise, consistent practice is key to mastering the curtsy lunge. Once you’ve mastered the basic curtsy lunge, you can increase the challenge by holding dumbbells or adding resistance bands. 1- Targeting Multiple Muscle Groups: Curtsy lunges primarily work the quadriceps, hamstrings, glutes, and adductors (inner thigh muscles). The diagonal motion engages these muscles in a unique way compared to traditional lunges, providing a more comprehensive lower body workout. 2- Improved Balance and Stability: Performing curtsy lunges challenges your balance and stability as you move in a diagonal direction, which helps strengthen the stabilizing muscles around your joints and core. 3- Enhanced Coordination: The cross-behind motion in the curtsy lunge requires coordination and proprioception, which can help improve overall body awareness and coordination. 4- Functional Strength: As a compound exercise, curtsy lunges mimic movements commonly used in daily activities, such as bending, stepping, and shifting weight, making them effective for improving functional strength and mobility. 5- Variety and Muscle Confusion: Incorporating curtsy lunges into your workout routine adds variety and can help prevent workout plateaus by targeting muscles from different angles. 6- Increased Range of Motion: The diagonal stepping motion in curtsy lunges can help improve hip mobility and flexibility, leading to better overall range of motion in the lower body. 7- Calorie Burn and Fat Loss: Like most lower body exercises, curtsy lunges are effective for burning calories and promoting fat loss, especially when incorporated into a high-intensity interval training (HIIT) or circuit training routine. 8- Minimal Equipment Required: Curtsy lunges can be performed with just your body weight or with added resistance such as dumbbells, kettlebells, or resistance bands, making them accessible and versatile for various fitness levels and environments. The curtsy lunge primarily targets the quadriceps, but it also engages several other muscles to assist in the movement and provide stability. Here’s a breakdown of the muscles worked during the curtsy lunge: By engaging these muscles, the curtsy lunge not only targets the quadriceps but also helps improve lower body strength, stability, and balance. It’s a compound exercise that engages multiple muscle groups simultaneously, making it an effective addition to lower body workouts.",
   "instructions": {
    "1": "Position yourself with your feet spaced hip-width apart, and keep your hands in front of your chest to help maintain balance.",
    "2": "Take a step diagonally behind you with your left foot, crossing it behind your right leg as if you were curtsying.",
    "3": "Bend both knees, lowering your body until your right thigh is parallel to the floor, and your left knee nearly touches the floor.",
    "4": "Push through your right heel to drive yourself back up to the starting position. Keep your torso upright and your chest lifted throughout the movement.",
    "5": "Continue alternating sides for the desired number of repetitions."
   },
   "muscle-group": [
    "Quadriceps",
    "Gluteus Maximus",
    "Adductor Magnus",
    "Soleus",
    "Hamstrings",
    "Gastrocnemius",
    "Gluteus Medius",
    "Gluteus Minimus",
    "Quadratus Lumborum",
    "Tibialis Anterior",
    "Obliques"
   ],
   "equipment": [
    "Full Gym",
    "NO EQUIPMENT"
   ],
   "exercise_image_url": "https://fitnessprogramer.com/wp-content/uploads/2023/09/curtsy-lunge.gif",
   "muscle_image_url": "https://fitnessprogramer.com/wp-content/uploads/2021/02/Pistol-squat-muscle-worked-300x300.png",
   "all-text": "CURTSY LUNGE EXERCISE / HIP, LEG WHAT IS CURTSY LUNGE? The curtsy lunge is a variation of the traditional lunge exercise that targets the muscles of the lower body, particularly the quadriceps, glutes, and adductors, while also engaging the core for stability. It involves stepping one leg behind the body at an angle, similar to performing a curtsy, hence the name. The curtsy lunge is an effective exercise for targeting multiple muscles in the lower body and can help improve strength, stability, and mobility. It's commonly incorporated into lower body workouts or as part of a dynamic warm-up routine. HOW TO PERFORM A CURTSY LUNGE Here's how to perform a curtsy lunge: Position yourself with your feet spaced hip-width apart, and keep your hands in front of your chest to help maintain balance. Take a step diagonally behind you with your left foot, crossing it behind your right leg as if you were curtsying. Bend both knees, lowering your body until your right thigh is parallel to the floor, and your left knee nearly touches the floor. Push through your right heel to drive yourself back up to the starting position. Keep your torso upright and your chest lifted throughout the movement. Continue alternating sides for the desired number of repetitions. MASTER THE CURTSY LUNGE Mastering the curtsy lunge involves paying attention to your form and gradually increasing the challenge as you become more proficient. As you lower your body, focus on pressing through the heel of your front foot to engage the muscles in your quads and glutes. Like any exercise, consistent practice is key to mastering the curtsy lunge. Once you've mastered the basic curtsy lunge, you can increase the challenge by holding dumbbells or adding resistance bands. TIPS FOR PROPER FORM: Keep your chest lifted and your shoulders relaxed throughout the movement. Engage your core muscles to stabilize your spine and pelvis. Keep your back straight, and avoid leaning forward or rounding your spine. Maintain a slow and controlled movement pattern to maximize the effectiveness of the exercise and reduce the risk of injury. BENEFITS OF CURTSY LUNGE 1- Targeting Multiple Muscle Groups: Curtsy lunges primarily work the quadriceps, hamstrings, glutes, and adductors (inner thigh muscles). The diagonal motion engages these muscles in a unique way compared to traditional lunges, providing a more comprehensive lower body workout. 2- Improved Balance and Stability: Performing curtsy lunges challenges your balance and stability as you move in a diagonal direction, which helps strengthen the stabilizing muscles around your joints and core. 3- Enhanced Coordination: The cross-behind motion in the curtsy lunge requires coordination and proprioception, which can help improve overall body awareness and coordination. 4- Functional Strength: As a compound exercise, curtsy lunges mimic movements commonly used in daily activities, such as bending, stepping, and shifting weight, making them effective for improving functional strength and mobility. 5- Variety and Muscle Confusion: Incorporating curtsy lunges into your workout routine adds variety and can help prevent workout plateaus by targeting muscles from different angles. 6- Increased Range of Motion: The diagonal stepping motion in curtsy lunges can help improve hip mobility and flexibility, leading to better overall range of motion in the lower body. 7- Calorie Burn and Fat Loss: Like most lower body exercises, curtsy lunges are effective for burning calories and promoting fat loss, especially when incorporated into a high-intensity interval training (HIIT) or circuit training routine. 8- Minimal Equipment Required: Curtsy lunges can be performed with just your body weight or with added resistance such as dumbbells, kettlebells, or resistance bands, making them accessible and versatile for various fitness levels and environments. WHAT MUSCLES DO CURTSY LUNGE WORK? The curtsy lunge primarily targets the quadriceps, but it also engages several other muscles to assist in the movement and provide stability. Here's a breakdown of the muscles worked during the curtsy lunge: Target - Quadriceps Synergists - Gluteus Maximus Synergists - Adductor Magnus Synergists - Soleus Dynamic Stabilizers - Hamstrings Dynamic Stabilizers - Gastrocnemius Stabilizers - Gluteus Medius Stabilizers - Gluteus Minimus Stabilizers - Quadratus Lumborum Stabilizers - Tibialis Anterior Stabilizers - Obliques Quadriceps: The muscles at the front of the thigh are the primary movers during the curtsy lunge, responsible for knee extension. Gluteus Maximus: The largest muscle of the buttocks assists in hip extension. Adductor Magnus: Located on the inner thigh, it aids in hip adduction and assists in stabilizing the pelvis. Soleus: The calf muscle helps with ankle plantar flexion. Hamstrings: Located at the back of the thigh, the hamstrings assist in hip extension and knee flexion. Gastrocnemius: The larger calf muscle also assists in ankle plantar flexion. Gluteus Medius and Gluteus Minimus: These muscles on the side of the hip stabilize the pelvis and help maintain proper alignment during the lunge. Quadratus Lumborum: Located on the lower back, it helps stabilize the spine and pelvis. Tibialis Anterior: The muscle on the front of the shin helps control dorsiflexion of the ankle. Obliques: These muscles on the sides of the abdomen assist in stabilizing the torso and pelvis during the movement. By engaging these muscles, the curtsy lunge not only targets the quadriceps but also helps improve lower body strength, stability, and balance. It's a compound exercise that engages multiple muscle groups simultaneously, making it an effective addition to lower body workouts. PREVIEW MUSCLE GROUPS Primary: Hip Leg EQUIPMENT Full Gym NO EQUIPMENT "
  },
  {
   "Title": "MEDICINE BALL ROTATIONAL THROW",
   "Desc": "The medicine ball rotational throw is a dynamic exercise that involves explosively rotating your torso while throwing a medicine ball. It targets the core, obliques, hips and upper back. It is commonly used in strength and conditioning programs for athletes in sports that require rotational power, such as baseball, golf, and tennis. By incorporating the medicine ball rotational throw into your workout routine, you can improve core strength, rotational power, and stability, which are beneficial for various sports and daily activities. Here’s a comprehensive guide to help you improve your skills and efficiency in performing this exercise. Mastering the medicine ball rotational throw requires a combination of proper technique, strength, power, and coordination. Understand the mechanics of the exercise, including the starting position, rotational movement, and throwing technique. Practice without the ball initially to focus on proper body mechanics and movement patterns. Gradually increase the weight of the medicine ball as you become more proficient with the exercise. By following these guidelines and focusing on consistent practice and improvement, you can master the medicine ball rotational throw and reap its benefits for core strength, power, and athletic performance. 1- Core Strength: Engages the muscles of the core, including the rectus abdominis, obliques, and transverse abdominis. Improves core stability and strength, essential for overall functional fitness. 2- Hip Power Development: Emphasizes explosive hip rotation, helping to develop power in the hip muscles. Strengthens the glutes and hip abductors, contributing to improved athletic performance. 3- Enhanced Coordination: Requires coordinated movement between the upper and lower body. Improves overall coordination, which is beneficial for various physical activities and sports. 4- Sports-Specific Training: Mimics the rotational movements seen in sports such as golf, tennis, baseball, and others. Provides sport-specific training for athletes involved in activities requiring rotational power. 5- Full-Body Workout: Involves multiple muscle groups, including the core, hips, upper back, and shoulders. Offers a comprehensive and efficient full-body workout in a single exercise. 6- Explosive Power: Focuses on explosive movements, aiding in the development of power and speed. Suitable for athletes looking to enhance their ability to generate force quickly. 7- Caloric Expenditure and Conditioning: Can be incorporated into high-intensity interval training (HIIT) for cardiovascular benefits. Supports fat loss and conditioning when performed with higher repetitions and intensity. 8- Improved Posture: Encourages proper body mechanics and posture during rotational movements. Reinforces good spinal alignment and body awareness. 9- Versatility: Adaptable to different fitness levels by adjusting the weight of the medicine ball and the intensity of the throws. Can be performed with various rep ranges to target different fitness goals. 10- Functional Movement: Enhances the ability to perform everyday activities involving rotational movements. Improves overall functional fitness, translating into better performance in daily life. The medicine ball rotational throw primarily targets the muscles involved in rotational movements, as well as those responsible for stabilizing the core and generating power. Here are the main muscles worked during the medicine ball rotational throw: While these are the primary muscles worked during the medicine ball rotational throw, other stabilizing muscles throughout the body may also be engaged to a lesser extent to support proper form and execution of the exercise.",
   "instructions": {
    "1": "Starting Position: Stand about two to four feet away from the wall, facing it, with a medicine ball held in both hands. Medicine ball (choose an appropriate weight based on your fitness level and goals).",
    "2": "Movement Preparation: Take the medicine ball to your back hip. This initial movement involves a rotation of the torso as you load the ball onto your back hip, preparing for the explosive throw.",
    "3": "Weight Transfer: Transfer your weight from the back hip to the front hip. This dynamic weight shift is a crucial component of generating power in the throw.",
    "4": "Hip Rotation: Rotate your hips explosively as you throw the ball against the wall. The explosive hip rotation is a key element for generating power in this exercise. Emphasize the power generated from the hips, not just the arms.",
    "5": "Catch and Repeat: After the ball rebounds off the wall, catch it with both hands. Take a moment to rest and then repeat the movement."
   },
   "muscle-group": [
    "Rectus Abdominis",
    "Obliques",
    "Transverse Abdominis",
    "Hip Abductors/Adductors",
    "Anterior Deltoid",
    "Trapezius",
    "Triceps",
    "Gluteus Medius",
    "Tensor fasciae latae",
    "Multifidus",
    "Erector Spinae",
    "Calves"
   ],
   "equipment": [
    "Exercise Ball",
    "Full Gym"
   ],
   "exercise_image_url": "https://fitnessprogramer.com/wp-content/uploads/2023/12/Medicine-Ball-Rotational-Throw.gif",
   "muscle_image_url": "https://fitnessprogramer.com/wp-content/uploads/2023/12/Medicine-Ball-Rotational-Throw-muscles-worked-2-300x300.png",
   "all-text": "MEDICINE BALL ROTATIONAL THROW EXERCISE / ABS WHAT IS THE MEDICINE BALL ROTATIONAL THROW? The medicine ball rotational throw is a dynamic exercise that involves explosively rotating your torso while throwing a medicine ball. It targets the core, obliques, hips and upper back. It is commonly used in strength and conditioning programs for athletes in sports that require rotational power, such as baseball, golf, and tennis. By incorporating the medicine ball rotational throw into your workout routine, you can improve core strength, rotational power, and stability, which are beneficial for various sports and daily activities. HOW TO DO: Here's a comprehensive guide to help you improve your skills and efficiency in performing this exercise. Starting Position: Stand about two to four feet away from the wall, facing it, with a medicine ball held in both hands. Medicine ball (choose an appropriate weight based on your fitness level and goals). Movement Preparation: Take the medicine ball to your back hip. This initial movement involves a rotation of the torso as you load the ball onto your back hip, preparing for the explosive throw. Weight Transfer: Transfer your weight from the back hip to the front hip. This dynamic weight shift is a crucial component of generating power in the throw. Hip Rotation: Rotate your hips explosively as you throw the ball against the wall. The explosive hip rotation is a key element for generating power in this exercise. Emphasize the power generated from the hips, not just the arms. Catch and Repeat: After the ball rebounds off the wall, catch it with both hands. Take a moment to rest and then repeat the movement. MASTER THE MEDICINE BALL ROTATIONAL THROW Mastering the medicine ball rotational throw requires a combination of proper technique, strength, power, and coordination. Understand the mechanics of the exercise, including the starting position, rotational movement, and throwing technique. Practice without the ball initially to focus on proper body mechanics and movement patterns. Gradually increase the weight of the medicine ball as you become more proficient with the exercise. TIPS: Engage your core throughout the movement to stabilize your spine. Emphasize the transfer of weight from the back hip to the front hip during the movement. Engage your core and focus on generating power through hip rotation. Keep a slight bend in your knees and maintain good posture. The arms serve as an extension of the hip rotation, so avoid relying solely on arm strength. Maintain a controlled and fluid motion, avoiding excessive tension in the neck and shoulders. Perform the exercise in a controlled manner, emphasizing both the throw and the catch. By following these guidelines and focusing on consistent practice and improvement, you can master the medicine ball rotational throw and reap its benefits for core strength, power, and athletic performance. BENEFITS OF MED-BALL ROTATIONAL THROW 1- Core Strength: Engages the muscles of the core, including the rectus abdominis, obliques, and transverse abdominis. Improves core stability and strength, essential for overall functional fitness. 2- Hip Power Development: Emphasizes explosive hip rotation, helping to develop power in the hip muscles. Strengthens the glutes and hip abductors, contributing to improved athletic performance. 3- Enhanced Coordination: Requires coordinated movement between the upper and lower body. Improves overall coordination, which is beneficial for various physical activities and sports. 4- Sports-Specific Training: Mimics the rotational movements seen in sports such as golf, tennis, baseball, and others. Provides sport-specific training for athletes involved in activities requiring rotational power. 5- Full-Body Workout: Involves multiple muscle groups, including the core, hips, upper back, and shoulders. Offers a comprehensive and efficient full-body workout in a single exercise. 6- Explosive Power: Focuses on explosive movements, aiding in the development of power and speed. Suitable for athletes looking to enhance their ability to generate force quickly. 7- Caloric Expenditure and Conditioning: Can be incorporated into high-intensity interval training (HIIT) for cardiovascular benefits. Supports fat loss and conditioning when performed with higher repetitions and intensity. 8- Improved Posture: Encourages proper body mechanics and posture during rotational movements. Reinforces good spinal alignment and body awareness. 9- Versatility: Adaptable to different fitness levels by adjusting the weight of the medicine ball and the intensity of the throws. Can be performed with various rep ranges to target different fitness goals. 10- Functional Movement: Enhances the ability to perform everyday activities involving rotational movements. Improves overall functional fitness, translating into better performance in daily life. MUSCLES WORKED The medicine ball rotational throw primarily targets the muscles involved in rotational movements, as well as those responsible for stabilizing the core and generating power. Here are the main muscles worked during the medicine ball rotational throw: Rectus Abdominis Obliques Transverse Abdominis Hip Abductors/Adductors Anterior Deltoid Trapezius Triceps Gluteus Medius Tensor fasciae latae Multifidus Erector Spinae Calves Rectus Abdominis: This is the muscle responsible for flexing the spine and is engaged during the rotation and throwing phases of the exercise. Obliques: Both the internal and external obliques are heavily engaged during the rotational movement, as they are responsible for rotating the torso and providing stability. Transverse Abdominis: This deep abdominal muscle helps stabilize the core and pelvis, providing support during rotational movements. Anterior Deltoid: The front shoulder muscles are activated during the throwing phase to help propel the medicine ball forward. Trapezius: The trapezius muscles in the upper back are engaged to stabilize the shoulder girdle and assist in transferring force from the core to the arms. Gluteus Medius: This muscle on the side of the hip helps stabilize the pelvis during the rotational movement. Erector Spinae: The muscles along the spine are engaged to maintain proper spinal alignment and support during the rotational movement. Tensor Fasciae Latae: This muscle located on the side of the hip assists in hip abduction and stabilization during the rotation. Multifidus: These small muscles along the spine help stabilize and support the vertebrae during movement. Triceps: The triceps muscles are engaged during the throwing phase to extend the arms and propel the medicine ball forward. While these are the primary muscles worked during the medicine ball rotational throw, other stabilizing muscles throughout the body may also be engaged to a lesser extent to support proper form and execution of the exercise. PREVIEW MUSCLE GROUPS Primary: Abs EQUIPMENT Exercise Ball Full Gym DIFFICULTY Plyometrics "
  },
  {
   "Title": "5 DOT DRILLS",
   "Desc": "The 5 Dot Drill is an agility workout that involves creating an X-shaped pattern using five markers positioned on the ground. The objective is to perform dynamic jumps and movements between these markers to enhance agility and coordination. Incorporating 5 Dot drills into your training regimen can be a valuable addition for individuals seeking to enhance their athletic performance, agility, and overall fitness.  1. Setup: 2. Initial Position (A-B):    3. Leap to Point C: 4. Leap to D and E (Split Feet): 5. Backward Jump: 6. Repeat: 1- Improved Agility: Agility is the ability to move the body quickly and easily while maintaining control and balance, especially in changing or challenging situations. The 5 Dot Drill is a specialized exercise designed to target and enhance agility through a series of dynamic and multidirectional movements. The dynamic and multidirectional movements required in the drill enhance agility by training the body to change direction quickly and efficiently. 2- Enhanced Coordination: The specific foot placements and dynamic movements required during the drill stimulate the connection between the brain and muscles, fostering improved coordination and neuromuscular control. The intentional and controlled nature of each step fosters a heightened connection between the brain and the muscles involved in the intricate footwork. This process not only sharpens the mind-muscle connection but also refines the intricate coordination skills necessary for diverse physical activities. 3- Increased Speed: The drill encourages participants to execute movements at an accelerated pace, fostering the development of speed and quickness. The incorporation of explosive jumps challenges the muscles to generate force rapidly. 4- Balance Development: Landing on and jumping between markers challenges the body’s balance and stability, activating core muscles and smaller stabilizing muscles in the legs, ankles, and feet. As participants land on one foot and transition between markers, they experience unilateral loading. This uneven distribution of weight challenges the body to stabilize and adapt to changes in load, promoting strength and balance on each leg independently. 5- Sports Performance: Sports are dynamic, and athletes must react quickly to changing situations. Athletes in sports such as basketball, soccer, tennis, and others that require quick lateral movements and changes in direction can benefit significantly from the sport-specific agility and speed developed through the 5 Dot Drill. 6- Cardiovascular Endurance: As a continuous and dynamic exercise, the 5 Dot Drill elevates heart rate and maintains it throughout the session, leading to improved cardiovascular endurance. Cardiovascular endurance is essential for activities that require sustained effort over time, such as prolonged workouts, sports matches, or even everyday tasks that demand continuous physical exertion. The 5 Dot Drill helps individuals build the stamina needed to perform these activities with greater ease and efficiency. 7- Caloric Expenditure: The continuous and rhythmic movements of the 5 Dot Drill result in increased caloric expenditure. This can be beneficial for those looking to manage weight or improve body composition, as it contributes to the overall energy balance by burning calories during the workout. 8- Plyometric Training: Plyometric exercises involve rapid contraction and extension of muscles, utilizing the stretch-shortening cycle. This cycle involves a rapid lengthening (eccentric phase) followed by an immediate shortening (concentric phase) of the muscle. Incorporating plyometric elements such as jumps and explosive movements in 5 Dot Drills contributes to lower-body power and explosiveness. In summary, 5 Dot Drills provide a comprehensive approach to physical fitness by targeting speed, coordination, agility, and incorporating plyometric training—all of which are crucial components for athletes and individuals seeking overall improvement in their physical performance. Here are the main muscles worked during the 5 Dot Drill: By targeting these muscles, the 5 Dot Drill helps improve lower body strength, power, agility, and coordination, making it a valuable exercise for athletes and individuals looking to enhance their athletic performance.",
   "instructions": {
    "1": "Quadriceps: Located at the front of the thigh, the quadriceps are engaged during the explosive jumps and directional changes of the drill.",
    "2": "Gluteus Maximus: The largest muscle in the buttocks, the gluteus maximus is involved in generating power during the jumps and providing stability during landings.",
    "3": "Hip Flexors: These muscles, including the iliopsoas, assist in lifting the legs and driving them upward during the drill’s movements.",
    "4": "Hamstrings: Situated at the back of the thigh, the hamstrings are engaged during both the explosive jumps and the controlled landings, helping to stabilize the knee joint.",
    "5": "Soleus: A calf muscle that assists in ankle plantar flexion, the soleus is engaged during the rapid foot movements and jumps of the 5 Dot Drill.",
    "6": "Gastrocnemius: Another calf muscle, the gastrocnemius works with the soleus to provide strength and stability to the ankle joint during the drill’s movements."
   },
   "muscle-group": [
    "Quadriceps",
    "Gluteus Maximus",
    "Hip Flexors",
    "Hamstrings",
    "Soleus",
    "Gastrocnemius"
   ],
   "equipment": [
    "Full Gym",
    "NO EQUIPMENT"
   ],
   "exercise_image_url": "https://fitnessprogramer.com/wp-content/uploads/2023/12/5-Dot-drills-agility-exercise.gif",
   "muscle_image_url": "https://fitnessprogramer.com/wp-content/uploads/2023/09/5-dot-drill-movement.png",
   "all-text": "5 DOT DRILLS EXERCISE / CARDIO, HIP, LEG WHA IS A 5 DOT DRILL? The 5 Dot Drill is an agility workout that involves creating an X-shaped pattern using five markers positioned on the ground. The objective is to perform dynamic jumps and movements between these markers to enhance agility and coordination. Incorporating 5 Dot drills into your training regimen can be a valuable addition for individuals seeking to enhance their athletic performance, agility, and overall fitness. HOW TO DO 5 DOT DRILL: 1. Setup: Arrange five markers on the ground in the sequence A-B-C-D-E to form the layout. Stand on the initial markers, A and B. 2. Initial Position (A-B): Commence with your feet together on markers A and B.   3. Leap to Point C: Swiftly jump forward to marker C, ensuring that your left foot lands precisely on the marker. 4. Leap to D and E (Split Feet): Following marker C, perform another explosive jump, but this time separate your feet. Land with one foot on marker D and the other on marker E. 5. Backward Jump: Execute a rapid backward jump using both feet, landing on marker C with your left foot. Immediately perform another backward jump to return to the starting position, markers A and B, with both feet together. Maintain control and balance throughout the entire movement. 6. Repeat: Duplicate the sequence, this time leading with your right leg. Strive to execute the drill with maximum speed while adhering to proper form. 8 BENEFITS OF 5 DOT DRILL 1- Improved Agility: Agility is the ability to move the body quickly and easily while maintaining control and balance, especially in changing or challenging situations. The 5 Dot Drill is a specialized exercise designed to target and enhance agility through a series of dynamic and multidirectional movements. The dynamic and multidirectional movements required in the drill enhance agility by training the body to change direction quickly and efficiently. 2- Enhanced Coordination: The specific foot placements and dynamic movements required during the drill stimulate the connection between the brain and muscles, fostering improved coordination and neuromuscular control. The intentional and controlled nature of each step fosters a heightened connection between the brain and the muscles involved in the intricate footwork. This process not only sharpens the mind-muscle connection but also refines the intricate coordination skills necessary for diverse physical activities. 3- Increased Speed: The drill encourages participants to execute movements at an accelerated pace, fostering the development of speed and quickness. The incorporation of explosive jumps challenges the muscles to generate force rapidly. 4- Balance Development: Landing on and jumping between markers challenges the body's balance and stability, activating core muscles and smaller stabilizing muscles in the legs, ankles, and feet. As participants land on one foot and transition between markers, they experience unilateral loading. This uneven distribution of weight challenges the body to stabilize and adapt to changes in load, promoting strength and balance on each leg independently. 5- Sports Performance: Sports are dynamic, and athletes must react quickly to changing situations. Athletes in sports such as basketball, soccer, tennis, and others that require quick lateral movements and changes in direction can benefit significantly from the sport-specific agility and speed developed through the 5 Dot Drill. 6- Cardiovascular Endurance: As a continuous and dynamic exercise, the 5 Dot Drill elevates heart rate and maintains it throughout the session, leading to improved cardiovascular endurance. Cardiovascular endurance is essential for activities that require sustained effort over time, such as prolonged workouts, sports matches, or even everyday tasks that demand continuous physical exertion. The 5 Dot Drill helps individuals build the stamina needed to perform these activities with greater ease and efficiency. 7- Caloric Expenditure: The continuous and rhythmic movements of the 5 Dot Drill result in increased caloric expenditure. This can be beneficial for those looking to manage weight or improve body composition, as it contributes to the overall energy balance by burning calories during the workout. 8- Plyometric Training: Plyometric exercises involve rapid contraction and extension of muscles, utilizing the stretch-shortening cycle. This cycle involves a rapid lengthening (eccentric phase) followed by an immediate shortening (concentric phase) of the muscle. Incorporating plyometric elements such as jumps and explosive movements in 5 Dot Drills contributes to lower-body power and explosiveness. In summary, 5 Dot Drills provide a comprehensive approach to physical fitness by targeting speed, coordination, agility, and incorporating plyometric training—all of which are crucial components for athletes and individuals seeking overall improvement in their physical performance. 5 DOT DRILL: MUSCLES WORKED Here are the main muscles worked during the 5 Dot Drill: Quadriceps Gluteus Maximus Hip Flexors Hamstrings Soleus Gastrocnemius Quadriceps: Located at the front of the thigh, the quadriceps are engaged during the explosive jumps and directional changes of the drill. Gluteus Maximus: The largest muscle in the buttocks, the gluteus maximus is involved in generating power during the jumps and providing stability during landings. Hip Flexors: These muscles, including the iliopsoas, assist in lifting the legs and driving them upward during the drill's movements. Hamstrings: Situated at the back of the thigh, the hamstrings are engaged during both the explosive jumps and the controlled landings, helping to stabilize the knee joint. Soleus: A calf muscle that assists in ankle plantar flexion, the soleus is engaged during the rapid foot movements and jumps of the 5 Dot Drill. Gastrocnemius: Another calf muscle, the gastrocnemius works with the soleus to provide strength and stability to the ankle joint during the drill's movements. By targeting these muscles, the 5 Dot Drill helps improve lower body strength, power, agility, and coordination, making it a valuable exercise for athletes and individuals looking to enhance their athletic performance. PREVIEW MUSCLE GROUPS Primary: Cardio Hip Leg EQUIPMENT Full Gym NO EQUIPMENT DIFFICULTY Plyometrics "
  },
  {
   "Title": "Staggered push-up",
   "all-text": "The staggered push-up is a variation of the push-up exercise where your hand position is staggered, with one hand forward and one back. It targets the same muscles as a traditional push-up, including the chest, triceps, and shoulders, but is more difficult to the rear arm and core.",
   "Type": "Strength",
   "BodyPart": "Chest",
   "Equipment": "Body Only",
   "Level": "Beginner",
   "Rating": "0.0",
   "RatingDesc": "Average",
   "YouTubeLink": "https://www.youtube.com/watch?v=C0rIRtcB4n8&pp=ygUiYm9keWJ1aWxkaW5nLmNvbSBTdGFnZ2VyZWQgcHVzaC11cA%3D%3D"
  },
  {
   "Title": "Reverse-grip hands-elevated push-up",
   "all-text": "The reverse-grip hands-elevated push-up is a bodyweight exercise performed on a Smith machine or other elevated surface. It targets the chest, triceps, and shoulders. It can work as a regression of floor reverse-grip push-ups, or in a progressive mechanical dropset moving the bar up once you reach failure at a lower height.",
   "Type": "Strength",
   "BodyPart": "Chest",
   "Equipment": "Body Only",
   "Level": "Beginner",
   "Rating": "0.0",
   "RatingDesc": "Average",
   "YouTubeLink": "https://www.youtube.com/watch?v=8k_R1uAeg7s&pp=ygU0Ym9keWJ1aWxkaW5nLmNvbSBSZXZlcnNlLWdyaXAgaGFuZHMtZWxldmF0ZWQgcHVzaC11cA%3D%3D"
  },
  {
   "Title": "Butterfly",
   "all-text": "The machine chest fly is an exercise targeting the chest. The motion is often compared to bear-hugging a tree trunk. In chest workouts, this exercise often follows compound moves such as the bench press.",
   "Type": "Strength",
   "BodyPart": "Chest",
   "Equipment": "Machine",
   "Level": "Intermediate",
   "Rating": "8.5",
   "RatingDesc": "Average",
   "YouTubeLink": "https://www.youtube.com/watch?v=oGxc2ph8Fnw&pp=ygUaYm9keWJ1aWxkaW5nLmNvbSBCdXR0ZXJmbHk%3D"
  }
 ]
}